{
  "$schema": "https://json-schema.org/draft/2020-12/schema",
  "title": "transition.json",
  "type": "object",
  "required": [
    "formatVersion",
    "id",
    "name",
    "category",
    "shader",
    "durationRangeUs",
    "parameters"
  ],
  "properties": {
    "formatVersion": {
      "const": 1
    },
    "id": {
      "type": "string"
    },
    "name": {
      "type": "string"
    },
    "category": {
      "type": "string"
    },
    "shader": {
      "type": "object",
      "required": [
        "path",
        "license"
      ],
      "properties": {
        "path": {
          "type": "string"
        },
        "license": {
          "type": "string"
        }
      },
      "additionalProperties": false
    },
    "durationRangeUs": {
      "type": "object",
      "required": [
        "min",
        "max"
      ],
      "properties": {
        "min": {
          "type": "integer",
          "minimum": 0
        },
        "max": {
          "type": "integer",
          "minimum": 0
        }
      },
      "additionalProperties": false
    },
    "parameters": {
      "type": "array",
      "items": {
        "type": "object",
        "required": [
          "id",
          "type",
          "default"
        ],
        "properties": {
          "id": {
            "type": "string"
          },
          "type": {
            "type": "string"
          },
          "default": {},
          "min": {
            "type": "number"
          },
          "max": {
            "type": "number"
          }
        },
        "additionalProperties": false
      }
    },
    "sound": {
      "type": "object",
      "required": [
        "path",
        "license"
      ],
      "properties": {
        "path": {
          "type": "string"
        },
        "license": {
          "type": "string"
        }
      },
      "additionalProperties": false
    }
  },
  "additionalProperties": false,
  "$id": "https://samvid.org/orchit/formats/transition.json.schema.json"
}
